{
  "doc_id": "sample",
  "source_file": "data/raw/HR/sample_raw.txt",
  "department": "HR",
  "chunks": [
    {
      "chunk_index": 0,
      "text": "人力資源部請假規則\n一、特休：員工每滿六個月可享三日特休，滿一年起依勞基法計算。",
      "metadata": {
        "source_file": "data/raw/HR/sample_raw.txt",
        "department": "HR"
      }
    },
    {
      "chunk_index": 1,
      "text": "二、事假：因私事需處理者，每次至少半日，全年累計不得超過十四日。\n三、病假：檢附醫療證明，全年不得超過三十日。超過部分依公司規定辦理。",
      "metadata": {
        "source_file": "data/raw/HR/sample_raw.txt",
        "department": "HR"
      }
    }
  ]
}
